{
  "action": {
    "kind": "move",
    "san": "f3",
    "uci": "f2f3"
  },
  "child": {
    "fen": "rnbqkbnr/pppppppp/8/8/8/5P2/PPPPP1PP/RNBQKBNR b KQkq - 0 1",
    "game_state_sha256": "18a915cd029ed54a5fede463fa17f855695171b57a62d45cd87738b1dd50a6ff",
    "history_counts": [
      [
        "3fe64cfd71680eca10d268e38036931d79e39edc4e55f9e56facb4de47bdab51",
        1
      ],
      [
        "5fff14a1814396798d5d67e856ab753fb117f2f41d4e0dcea98696f5102ac071",
        1
      ]
    ],
    "position_sha256": "096928e67374db1ff54127c91400b93687dbce1e88624a0cda2eba7cef4b2dd4",
    "side_to_move": "black"
  },
  "obligation_id": "root-13-f2f3",
  "parent": {
    "fen": "rnbqkbnr/pppppppp/8/8/8/8/PPPPPPPP/RNBQKBNR w KQkq - 0 1",
    "game_state_sha256": "eef9110182efec68661804d99fb8a91a1eac10973bdb4a44569d66ac0c9f8078",
    "history_counts": [
      [
        "5fff14a1814396798d5d67e856ab753fb117f2f41d4e0dcea98696f5102ac071",
        1
      ]
    ],
    "position_sha256": "5a11ce6025ea01d38792feb2e60538f380ae51220d40ebcb589ce13b43274c95"
  },
  "proof_rule": "The child WDL is from the child side-to-move perspective. It becomes authoritative only after an independent checker accepts a complete certificate.",
  "schema": "ugts-chess-proof-obligation-2.0",
  "target": "exact-full-game-WDL-under-declared-FIDE-profile",
  "verification": "unverified",
  "wdl": "unknown"
}
