{
  "action": {
    "kind": "move",
    "san": "Nf3",
    "uci": "g1f3"
  },
  "child": {
    "fen": "rnbqkbnr/pppppppp/8/8/8/5N2/PPPPPPPP/RNBQKB1R b KQkq - 1 1",
    "game_state_sha256": "7bce0082b2e70e67ad230506edd9899ddd0b49d8f9a3c94696abede8bd43b2f3",
    "history_counts": [
      [
        "13761fadc8099413e1f51fe7c0b0c44634638aec25278eb3b458335f7f797bf4",
        1
      ],
      [
        "5fff14a1814396798d5d67e856ab753fb117f2f41d4e0dcea98696f5102ac071",
        1
      ]
    ],
    "position_sha256": "c148062998219821531a1764398ca11443a3f7688ad58d11a2cd82d3699e2f44",
    "side_to_move": "black"
  },
  "obligation_id": "root-15-g1f3",
  "parent": {
    "fen": "rnbqkbnr/pppppppp/8/8/8/8/PPPPPPPP/RNBQKBNR w KQkq - 0 1",
    "game_state_sha256": "eef9110182efec68661804d99fb8a91a1eac10973bdb4a44569d66ac0c9f8078",
    "history_counts": [
      [
        "5fff14a1814396798d5d67e856ab753fb117f2f41d4e0dcea98696f5102ac071",
        1
      ]
    ],
    "position_sha256": "5a11ce6025ea01d38792feb2e60538f380ae51220d40ebcb589ce13b43274c95"
  },
  "proof_rule": "The child WDL is from the child side-to-move perspective. It becomes authoritative only after an independent checker accepts a complete certificate.",
  "schema": "ugts-chess-proof-obligation-2.0",
  "target": "exact-full-game-WDL-under-declared-FIDE-profile",
  "verification": "unverified",
  "wdl": "unknown"
}
